{
 "id": "monster.manticora",
 "name": "Mantícora",
 "source": {
  "book": "SRD 5.2.1 es",
  "page": 347
 },
 "context": [
  "Mantícora"
 ],
 "metaRaw": "Monstruosidad Grande, legal malvada",
 "type": "Monstruosidad",
 "alignment": "legal malvada",
 "size": "Grande",
 "ac": 14,
 "acRaw": "14",
 "initiative": {
  "mod": 3,
  "score": 13
 },
 "hp": {
  "raw": "68 (8d10 + 24)",
  "average": 68,
  "formula": "8d10 + 24"
 },
 "speeds": {
  "caminando": 9.0,
  "volar": 15.0
 },
 "senses": {
  "raw": "visión en la oscuridad 18 m; Percepción pasiva 11",
  "passivePerception": 11
 },
 "languages": [
  "común"
 ],
 "challenge": {
  "raw": "3 (700 PX; BC +2)",
  "cr": 3,
  "xp": 700,
  "proficiencyBonus": 2
 },
 "abilities": {
  "fue": {
   "score": 17,
   "mod": 3,
   "save": 3
  },
  "des": {
   "score": 16,
   "mod": 3,
   "save": 3
  },
  "con": {
   "score": 17,
   "mod": 3,
   "save": 3
  },
  "int": {
   "score": 7,
   "mod": -2,
   "save": -2
  },
  "sab": {
   "score": 12,
   "mod": 1,
   "save": 1
  },
  "car": {
   "score": 8,
   "mod": -1,
   "save": -1
  }
 },
 "actions": [
  {
   "name": "Ataque múltiple",
   "md": "***Ataque múltiple.*** La mantícora realiza tres ataques de desgarro o con sus púas de cola en cualquier combinación.",
   "page": 347,
   "description": "La mantícora realiza tres ataques de desgarro o con sus púas de cola en cualquier combinación."
  },
  {
   "name": "Desgarro",
   "md": "***Desgarro.*** *Tirada de ataque cuerpo a cuerpo:* +5, alcance 1,5 m. *Acierto:* 7 (1d8 + 3) de daño cortante.",
   "page": 347,
   "description": "*Tirada de ataque cuerpo a cuerpo:* +5, alcance 1,5 m. *Acierto:* 7 (1d8 + 3) de daño cortante."
  },
  {
   "name": "Púas de cola",
   "md": "***Púas de cola.*** *Tirada de ataque a distancia:* +5, alcance 30/60 m. *Acierto:* 7 (1d8 + 3) de daño perforante.",
   "page": 347,
   "description": "*Tirada de ataque a distancia:* +5, alcance 30/60 m. *Acierto:* 7 (1d8 + 3) de daño perforante."
  }
 ]
}