{
 "id": "monster.enjambre-de-murcielagos",
 "name": "Enjambre de murciélagos",
 "source": {
  "book": "SRD 5.2.1 es",
  "page": 384
 },
 "context": [
  "Animales"
 ],
 "metaRaw": "Enjambre Grande de bestias Diminutas, sin alineamiento",
 "type": "Enjambre de bestias Diminutas",
 "alignment": "sin alineamiento",
 "size": "Grande",
 "ac": 12,
 "acRaw": "12",
 "initiative": {
  "mod": 2,
  "score": 12
 },
 "hp": {
  "raw": "11 (2d10)",
  "average": 11,
  "formula": "2d10"
 },
 "speeds": {
  "caminando": 1.5,
  "volar": 9.0
 },
 "senses": {
  "raw": "visión ciega 18 m; Percepción pasiva 11",
  "passivePerception": 11
 },
 "languages": [
  "ninguno"
 ],
 "immunities": [
  "agarrado",
  "apresado",
  "asustado",
  "aturdido",
  "derribado",
  "hechizado",
  "paralizado",
  "petrificado"
 ],
 "resistances": [
  "contundente",
  "cortante",
  "perforante"
 ],
 "challenge": {
  "raw": "1/4 (50 PX; BC +2)",
  "cr": 0.25,
  "xp": 50,
  "proficiencyBonus": 2
 },
 "abilities": {
  "fue": {
   "score": 5,
   "mod": -3,
   "save": -3
  },
  "des": {
   "score": 15,
   "mod": 2,
   "save": 2
  },
  "con": {
   "score": 10,
   "mod": 0,
   "save": 0
  },
  "int": {
   "score": 2,
   "mod": -4,
   "save": -4
  },
  "sab": {
   "score": 12,
   "mod": 1,
   "save": 1
  },
  "car": {
   "score": 4,
   "mod": -3,
   "save": -3
  }
 },
 "traits": [
  {
   "name": "Enjambre",
   "md": "***Enjambre.*** El enjambre puede ocupar el espacio de otra criatura y viceversa, y es capaz de atravesar cualquier abertura por la que quepa un murciélago Diminuto. El enjambre no puede recuperar puntos de golpe ni obtener puntos de golpe temporales.",
   "page": 384,
   "description": "El enjambre puede ocupar el espacio de otra criatura y viceversa, y es capaz de atravesar cualquier abertura por la que quepa un murciélago Diminuto. El enjambre no puede recuperar puntos de golpe ni obtener puntos de golpe temporales."
  }
 ],
 "actions": [
  {
   "name": "Mordiscos",
   "md": "***Mordiscos.*** *Tirada de ataque cuerpo a cuerpo:* +4, alcance 1,5 m. *Acierto:* 5 (2d4) de daño perforante o 2 (1d4) de daño perforante si el enjambre está maltrecho.",
   "page": 384,
   "description": "*Tirada de ataque cuerpo a cuerpo:* +4, alcance 1,5 m. *Acierto:* 5 (2d4) de daño perforante o 2 (1d4) de daño perforante si el enjambre está maltrecho."
  }
 ]
}