{
 "id": "monster.dragon-verde-anciano",
 "name": "Dragón verde anciano",
 "source": {
  "book": "SRD 5.2.1 es",
  "page": 316
 },
 "context": [
  "Dragones verdes"
 ],
 "metaRaw": "Dragón Gargantuesco (cromático), legal malvado",
 "type": "Dragón",
 "alignment": "legal malvado",
 "size": "Gargantuesco",
 "tags": [
  "cromático"
 ],
 "ac": 21,
 "acRaw": "21",
 "initiative": {
  "mod": 15,
  "score": 25
 },
 "hp": {
  "raw": "402 (23d20 + 161)",
  "average": 402,
  "formula": "23d20 + 161"
 },
 "speeds": {
  "caminando": 12.0,
  "nadar": 12.0,
  "volar": 24.0
 },
 "skills": {
  "Engaño": 13,
  "Percepción": 17,
  "Persuasión": 13,
  "Sigilo": 8
 },
 "senses": {
  "raw": "visión ciega 18 m, visión en la oscuridad 36 m; Percepción pasiva 27",
  "passivePerception": 27
 },
 "languages": [
  "común",
  "dracónico"
 ],
 "immunities": [
  "veneno",
  "envenenado"
 ],
 "challenge": {
  "raw": "22 (41 000 PX o 50 000 en la guarida; BC +7)",
  "cr": 22,
  "xp": 41000,
  "proficiencyBonus": 7,
  "xpInLair": 50000
 },
 "abilities": {
  "fue": {
   "score": 27,
   "mod": 8,
   "save": 8
  },
  "des": {
   "score": 12,
   "mod": 1,
   "save": 8
  },
  "con": {
   "score": 25,
   "mod": 7,
   "save": 7
  },
  "int": {
   "score": 20,
   "mod": 5,
   "save": 5
  },
  "sab": {
   "score": 17,
   "mod": 3,
   "save": 10
  },
  "car": {
   "score": 22,
   "mod": 6,
   "save": 6
  }
 },
 "traits": [
  {
   "name": "Anfibio",
   "md": "***Anfibio.*** El dragón puede respirar tanto dentro como fuera del agua.",
   "page": 316,
   "description": "El dragón puede respirar tanto dentro como fuera del agua."
  },
  {
   "name": "Resistencia legendaria",
   "md": "***Resistencia legendaria (4/día o 5/día en la guarida).*** El dragón puede elegir tener éxito en una tirada de salvación que haya fallado.",
   "page": 316,
   "description": "El dragón puede elegir tener éxito en una tirada de salvación que haya fallado.",
   "uses": "4/día o 5/día en la guarida"
  }
 ],
 "actions": [
  {
   "name": "Ataque múltiple",
   "md": "***Ataque múltiple.*** El dragón realiza tres ataques de desgarro. Puede sustituir un ataque por un uso de su lanzamiento de conjuros para lanzar *clavo mental* (versión de nivel 5).",
   "page": 316,
   "description": "El dragón realiza tres ataques de desgarro. Puede sustituir un ataque por un uso de su lanzamiento de conjuros para lanzar *clavo mental* (versión de nivel 5)."
  },
  {
   "name": "Desgarro",
   "md": "***Desgarro.*** *Tirada de ataque cuerpo a cuerpo:* +15, alcance 4,5 m. *Acierto:* 17 (2d8 + 8) de daño cortante más 10 (3d6) de daño de veneno.",
   "page": 316,
   "description": "*Tirada de ataque cuerpo a cuerpo:* +15, alcance 4,5 m. *Acierto:* 17 (2d8 + 8) de daño cortante más 10 (3d6) de daño de veneno."
  },
  {
   "name": "Aliento venenoso",
   "md": "***Aliento venenoso (recarga 5–6).*** *Tirada de salvación de Constitución:* CD 22, todas las criaturas en un cono de 27 m. *Fallo:* 77 (22d6) de daño de veneno. *Éxito:* la mitad del daño.",
   "page": 316,
   "description": "*Tirada de salvación de Constitución:* CD 22, todas las criaturas en un cono de 27 m. *Fallo:* 77 (22d6) de daño de veneno. *Éxito:* la mitad del daño.",
   "uses": "recarga 5–6"
  },
  {
   "name": "Lanzamiento de conjuros",
   "md": "***Lanzamiento de conjuros.*** El dragón lanza uno de los siguientes conjuros, que no requiere componentes materiales y utiliza el Carisma como aptitud mágica (CD de salvación de conjuros 21):",
   "page": 316,
   "description": "El dragón lanza uno de los siguientes conjuros, que no requiere componentes materiales y utiliza el Carisma como aptitud mágica (CD de salvación de conjuros 21):"
  },
  {
   "name": null,
   "md": "A voluntad: *clavo mental* (versión de nivel 5), *detectar magia* 1/día cada uno: *alterar los recuerdos*, *geas*",
   "page": 316
  }
 ],
 "legendary": {
  "actions": [
   {
    "name": "Abalanzarse",
    "md": "***Abalanzarse.*** El dragón se mueve hasta la mitad de su velocidad y realiza un ataque de desgarro.",
    "page": 316,
    "description": "El dragón se mueve hasta la mitad de su velocidad y realiza un ataque de desgarro."
   },
   {
    "name": "Invasión mental",
    "md": "***Invasión mental.*** El dragón utiliza su lanzamiento de conjuros para lanzar *clavo mental* (versión de nivel 5).",
    "page": 316,
    "description": "El dragón utiliza su lanzamiento de conjuros para lanzar *clavo mental* (versión de nivel 5)."
   },
   {
    "name": "Miasma venenoso",
    "md": "***Miasma venenoso.*** *Tirada de salvación de Constitución:* CD 21, todas las criaturas en una esfera de 9 m de radio centrada en un punto que el dragón pueda ver a 27 m o menos. *Fallo:* 17 (5d6) de daño de veneno y el objetivo tendrá un penalizador de −2 a la CA hasta el final de su siguiente turno. *Fallo o éxito:* el dragón no puede volver a realizar esta acción hasta el principio de su siguiente turno.",
    "page": 316,
    "description": "*Tirada de salvación de Constitución:* CD 21, todas las criaturas en una esfera de 9 m de radio centrada en un punto que el dragón pueda ver a 27 m o menos. *Fallo:* 17 (5d6) de daño de veneno y el objetivo tendrá un penalizador de −2 a la CA hasta el final de su siguiente turno. *Fallo o éxito:* el dragón no puede volver a realizar esta acción hasta el principio de su siguiente turno."
   }
  ],
  "intro": "Usos de acciones legendarias: 3 (4 en la guarida). Justo después del turno de otra criatura, el dragón puede emplear un uso para llevar a cabo una de las siguientes acciones. El dragón recupera todos los usos al principio de cada uno de sus turnos.",
  "uses": 3,
  "usesInLair": 4
 },
 "refs": [
  "spell.clavo-mental",
  "spell.detectar-magia",
  "spell.alterar-los-recuerdos",
  "spell.geas"
 ]
}